{
  "schema_version": "1.0.0",
  "record_type": "experience_descriptor_decision_register",
  "register_id": "XDR-900001",
  "metadata_only": true,
  "register_state": "active",
  "catalogue_id": "XDC-900001",
  "decisions": [{
    "decision_id": "XDD-900001",
    "source_id": "SRC-SYN-001",
    "final_disposition": "described",
    "descriptor_profile": {
      "domain_ids": ["XDV-DOM-900001"],
      "record_kind_id": "XDV-KND-900001",
      "task_trigger_ids": ["XDV-TRG-900001"],
      "target_object_ids": ["XDV-OBJ-900001"],
      "scope_id": "XDV-SCP-900001"
    },
    "topic_term_ids": ["XVT-900001"],
    "concise_reason": "Synthetic descriptor decision for structural validation.",
    "reviewed_on": "2026-07-30",
    "accountable_human_reference": "synthetic-human",
    "limitations_and_reconsideration_trigger": "Synthetic fixture only."
  }]
}
